{
  "id": "GHSA-c3gv-9cxf-6f57",
  "modified": "2024-01-15T10:00:00Z",
  "summary": "SQL Injection vulnerability in example-package",
  "affected": [
    {
      "package": {
        "name": "example-package",
        "ecosystem": "npm"
      },
      "ranges": [
        {
          "type": "SEMVER",
          "events": [{ "introduced": "1.0.0" }, { "fixed": "1.0.5" }]
        }
      ]
    }
  ]
}
